{
  "event_id": "00000000-0000-0000-0000-000000000000",
  "schema_version": 1,
  "device_id": "00000000-0000-0000-0000-000000000000",
  "source_seq": 0,
  "hlc": 0,
  "observed_at": 1787904000000000,
  "captured_at": 0,
  "provider": "codex",
  "adapter_version": "0.1.1",
  "hook_version": "test",
  "capture_mode": "local_semantic",
  "provider_event_name": "PostToolUse",
  "kind": "tool_call_finished",
  "project": {
    "project_id": "2c38b208-07f6-59a6-9871-ceaf11d5bf00",
    "root": "/home/dev/example/project",
    "name": "example/project",
    "repo_remote": "github.com/example/project"
  },
  "session_id": "cc9d805e-9f44-5831-830c-1999907c3f5f",
  "provider_session_id": "sess-codex-canary",
  "provider_turn_id": "turn-9",
  "agent": {
    "agent_id": "3f2cd83c-2bb4-579a-840d-fff7f884f848"
  },
  "tool": {
    "name": "shell",
    "category": "shell",
    "call_id": "call_01Canary"
  },
  "outcome": {
    "status": "success",
    "exit_code": 0
  },
  "attrs": {
    "hook_event_name": "PostToolUse",
    "cwd": "~/example/project",
    "command_bytes": 89,
    "command_category": "network",
    "command_subcategory": "shell.builtin"
  },
  "content": {
    "command": "bash -lc export API_KEY=sk-live-CANARY_CODEX_KEY && curl -s https://api.example.com/v1/me",
    "tool_input": {
      "command": [
        "bash",
        "-lc",
        "export API_KEY=sk-live-CANARY_CODEX_KEY && curl -s https://api.example.com/v1/me"
      ]
    },
    "tool_output": {
      "output": "{\"ok\":true,\"token\":\"CANARY_CODEX_OUTPUT\"}",
      "exit_code": 0
    }
  },
  "raw": {
    "hook_event_name": "PostToolUse",
    "session_id": "sess-codex-canary",
    "turn_id": "turn-9",
    "cwd": "/home/dev/example/project",
    "tool_name": "shell",
    "tool_use_id": "call_01Canary",
    "tool_input": {
      "command": [
        "bash",
        "-lc",
        "export API_KEY=sk-live-CANARY_CODEX_KEY && curl -s https://api.example.com/v1/me"
      ]
    },
    "tool_response": {
      "output": "{\"ok\":true,\"token\":\"CANARY_CODEX_OUTPUT\"}",
      "exit_code": 0
    }
  }
}
