{
  "event_id": "00000000-0000-0000-0000-000000000000",
  "schema_version": 1,
  "device_id": "00000000-0000-0000-0000-000000000000",
  "source_seq": 0,
  "hlc": 0,
  "observed_at": 1787904000000000,
  "captured_at": 0,
  "provider": "cursor",
  "adapter_version": "0.1.1",
  "hook_version": "test",
  "capture_mode": "local_semantic",
  "provider_event_name": "afterShellExecution",
  "kind": "tool_call_failed",
  "project": {
    "project_id": "2c38b208-07f6-59a6-9871-ceaf11d5bf00",
    "root": "/home/dev/example/project",
    "name": "example/project",
    "repo_remote": "github.com/example/project"
  },
  "session_id": "575fa425-ded3-51e0-9cb1-e263f2fe54a9",
  "provider_session_id": "conv-cursor-1",
  "provider_turn_id": "gen-cursor-4",
  "agent": {
    "agent_id": "191cbba6-63f0-59a4-817a-adcd46e91cdb"
  },
  "tool": {
    "name": "Shell",
    "category": "shell"
  },
  "outcome": {
    "status": "failure",
    "class": "nonzero_exit",
    "exit_code": 1
  },
  "duration_ms": 3900,
  "attrs": {
    "hook_event_name": "afterShellExecution",
    "provider": {
      "generation_id": "gen-cursor-4"
    },
    "command_bytes": 25,
    "command_category": "test",
    "command_subcategory": "pkg.test",
    "error_class": "nonzero_exit"
  },
  "content": {
    "command": "npm test -- --watch=false",
    "tool_input": {
      "command": "npm test -- --watch=false"
    },
    "tool_output": "FAIL src/app.test.ts\n  Expected token sk-live-CANARY_CURSOR_OUT to be rejected"
  },
  "raw": {
    "hook_event_name": "afterShellExecution",
    "conversation_id": "conv-cursor-1",
    "generation_id": "gen-cursor-4",
    "command": "npm test -- --watch=false",
    "output": "FAIL src/app.test.ts\n  Expected token sk-live-CANARY_CURSOR_OUT to be rejected",
    "exit_code": 1,
    "duration": 3900
  }
}
