{
  "event_id": "00000000-0000-0000-0000-000000000000",
  "schema_version": 1,
  "device_id": "00000000-0000-0000-0000-000000000000",
  "source_seq": 0,
  "hlc": 0,
  "observed_at": 1787904000000000,
  "captured_at": 0,
  "provider": "cursor",
  "provider_version": "1.7.11",
  "adapter_version": "0.1.1",
  "hook_version": "test",
  "capture_mode": "local_semantic",
  "provider_event_name": "afterFileEdit",
  "kind": "tool_call_finished",
  "project": {
    "project_id": "2c38b208-07f6-59a6-9871-ceaf11d5bf00",
    "root": "/home/dev/example/project",
    "name": "example/project",
    "repo_remote": "github.com/example/project"
  },
  "session_id": "575fa425-ded3-51e0-9cb1-e263f2fe54a9",
  "provider_session_id": "conv-cursor-1",
  "provider_turn_id": "gen-cursor-1",
  "agent": {
    "agent_id": "191cbba6-63f0-59a4-817a-adcd46e91cdb",
    "model": "claude-4.5-sonnet"
  },
  "tool": {
    "name": "Edit",
    "category": "file_edit"
  },
  "paths": [
    {
      "original": "~/example/project/src/components/Button.tsx",
      "logical": "~/example/project/src/components/Button.tsx",
      "repo_relative": "src/components/Button.tsx"
    }
  ],
  "outcome": {
    "status": "success"
  },
  "attrs": {
    "hook_event_name": "afterFileEdit",
    "provider": {
      "generation_id": "gen-cursor-1",
      "edit_count": 1
    },
    "file_ext": "tsx",
    "file_is_test": false,
    "file_is_config": false,
    "file_is_doc": false,
    "lines_added": 4,
    "lines_removed": 1
  },
  "content": {
    "tool_input": {
      "file_path": "/home/dev/example/project/src/components/Button.tsx",
      "edits": [
        {
          "old_string": "<button onClick={onPress}>",
          "new_string": "<button\n  onClick={onPress}\n  disabled={loading}\n>"
        }
      ]
    }
  },
  "raw": {
    "hook_event_name": "afterFileEdit",
    "conversation_id": "conv-cursor-1",
    "generation_id": "gen-cursor-1",
    "model": "claude-4.5-sonnet",
    "cursor_version": "1.7.11",
    "workspace_roots": [
      "/home/dev/example/project"
    ],
    "user_email": "dev@example.com",
    "file_path": "/home/dev/example/project/src/components/Button.tsx",
    "edits": [
      {
        "old_string": "<button onClick={onPress}>",
        "new_string": "<button\n  onClick={onPress}\n  disabled={loading}\n>"
      }
    ]
  }
}
