{
  "event_id": "00000000-0000-0000-0000-000000000000",
  "schema_version": 1,
  "device_id": "00000000-0000-0000-0000-000000000000",
  "source_seq": 0,
  "hlc": 0,
  "observed_at": 1787904000000000,
  "captured_at": 0,
  "provider": "cursor",
  "adapter_version": "0.1.1",
  "hook_version": "test",
  "capture_mode": "local_semantic",
  "provider_event_name": "preToolUse",
  "kind": "tool_call_started",
  "project": {
    "project_id": "2c38b208-07f6-59a6-9871-ceaf11d5bf00",
    "root": "/home/dev/example/project",
    "name": "example/project",
    "repo_remote": "github.com/example/project"
  },
  "session_id": "575fa425-ded3-51e0-9cb1-e263f2fe54a9",
  "provider_session_id": "conv-cursor-1",
  "provider_turn_id": "gen-cursor-1",
  "agent": {
    "agent_id": "191cbba6-63f0-59a4-817a-adcd46e91cdb"
  },
  "tool": {
    "name": "MCP:github:create_issue",
    "category": "mcp",
    "call_id": "tu-3"
  },
  "attrs": {
    "hook_event_name": "preToolUse",
    "provider": {
      "generation_id": "gen-cursor-1"
    }
  },
  "content": {
    "tool_input": {
      "title": "retry the sync client",
      "body": "see the thread"
    }
  },
  "raw": {
    "hook_event_name": "preToolUse",
    "conversation_id": "conv-cursor-1",
    "generation_id": "gen-cursor-1",
    "tool_name": "MCP:github:create_issue",
    "tool_use_id": "tu-3",
    "tool_input": {
      "title": "retry the sync client",
      "body": "see the thread"
    }
  }
}
