{
  "event_id": "00000000-0000-0000-0000-000000000000",
  "schema_version": 1,
  "device_id": "00000000-0000-0000-0000-000000000000",
  "source_seq": 0,
  "hlc": 0,
  "observed_at": 1787904000000000,
  "captured_at": 0,
  "provider": "claude_code",
  "adapter_version": "0.1.1",
  "hook_version": "test",
  "capture_mode": "local_semantic",
  "provider_event_name": "PreCompact",
  "kind": "compaction_started",
  "project": {
    "project_id": "2c38b208-07f6-59a6-9871-ceaf11d5bf00",
    "root": "/home/dev/example/project",
    "name": "example/project",
    "repo_remote": "github.com/example/project"
  },
  "session_id": "418e56c2-a7e4-5d2c-b44b-a33f13e70aee",
  "provider_session_id": "sess-compact-1",
  "agent": {
    "agent_id": "29522c47-e14e-5d3a-8512-2154ba8132a2"
  },
  "attrs": {
    "hook_event_name": "PreCompact",
    "cwd": "~/example/project",
    "permission_mode": "default",
    "transcript_present": true,
    "trigger": "manual"
  },
  "content": {
    "custom_instructions": "Keep the list of failing tests and the SECRET_TOKEN rotation plan."
  },
  "raw": {
    "hook_event_name": "PreCompact",
    "session_id": "sess-compact-1",
    "cwd": "/home/dev/example/project",
    "permission_mode": "default",
    "trigger": "manual",
    "custom_instructions": "Keep the list of failing tests and the SECRET_TOKEN rotation plan."
  }
}
