{
  "event_id": "00000000-0000-0000-0000-000000000000",
  "schema_version": 1,
  "device_id": "00000000-0000-0000-0000-000000000000",
  "source_seq": 0,
  "hlc": 0,
  "observed_at": 1787904000000000,
  "captured_at": 0,
  "provider": "claude_code",
  "adapter_version": "0.1.1",
  "hook_version": "test",
  "capture_mode": "local_semantic",
  "provider_event_name": "UserPromptSubmit",
  "kind": "prompt_submitted",
  "project": {
    "project_id": "2c38b208-07f6-59a6-9871-ceaf11d5bf00",
    "root": "/home/dev/example/project",
    "name": "example/project",
    "repo_remote": "github.com/example/project"
  },
  "session_id": "279471f7-51cf-5c2a-99b0-1c1dde4f66cd",
  "provider_session_id": "sess-prompt-1",
  "agent": {
    "agent_id": "360b74a8-482e-5e75-a08c-059657ccabf4"
  },
  "attrs": {
    "hook_event_name": "UserPromptSubmit",
    "prompt_chars": 33,
    "prompt_lines": 1,
    "prompt_has_code_fence": false,
    "prompt_has_question": true
  },
  "content": {
    "prompt": "안녕하세요, 이 함수가 왜 안 돌아가는지 봐주실 수 있나요?"
  },
  "raw": {
    "hook_event_name": "UserPromptSubmit",
    "prompt": "안녕하세요, 이 함수가 왜 안 돌아가는지 봐주실 수 있나요?",
    "session_id": "sess-prompt-1"
  }
}
