{
  "event_id": "00000000-0000-0000-0000-000000000000",
  "schema_version": 1,
  "device_id": "00000000-0000-0000-0000-000000000000",
  "source_seq": 0,
  "hlc": 0,
  "observed_at": 1787904000000000,
  "captured_at": 0,
  "provider": "cursor",
  "adapter_version": "0.1.1",
  "hook_version": "test",
  "capture_mode": "local_semantic",
  "provider_event_name": "beforeSubmitPrompt",
  "kind": "prompt_submitted",
  "project": {
    "project_id": "2c38b208-07f6-59a6-9871-ceaf11d5bf00",
    "root": "/home/dev/example/project",
    "name": "example/project",
    "repo_remote": "github.com/example/project"
  },
  "session_id": "575fa425-ded3-51e0-9cb1-e263f2fe54a9",
  "provider_session_id": "conv-cursor-1",
  "agent": {
    "agent_id": "191cbba6-63f0-59a4-817a-adcd46e91cdb"
  },
  "paths": [
    {
      "original": "/home/dev/example/project/components/slime/SlimeCanvas.tsx",
      "logical": "/home/dev/example/project/components/slime/SlimeCanvas.tsx",
      "repo_relative": "components/slime/SlimeCanvas.tsx"
    }
  ],
  "attrs": {
    "hook_event_name": "beforeSubmitPrompt",
    "prompt_chars": 38,
    "prompt_lines": 1,
    "prompt_has_code_fence": false,
    "prompt_has_question": false,
    "provider": {
      "attachment_count": 1
    }
  },
  "content": {
    "prompt": "슬라임 캔버스 프레임 루프를 리팩터링해줘. 상태 머신은 그대로 두고."
  },
  "raw": {
    "hook_event_name": "beforeSubmitPrompt",
    "conversation_id": "conv-cursor-1",
    "prompt": "슬라임 캔버스 프레임 루프를 리팩터링해줘. 상태 머신은 그대로 두고.",
    "attachments": [
      {
        "type": "file",
        "file_path": "/home/dev/example/project/components/slime/SlimeCanvas.tsx"
      }
    ]
  }
}
