{
  "event_id": "00000000-0000-0000-0000-000000000000",
  "schema_version": 1,
  "device_id": "00000000-0000-0000-0000-000000000000",
  "source_seq": 0,
  "hlc": 0,
  "observed_at": 1787904000000000,
  "captured_at": 0,
  "provider": "claude_code",
  "adapter_version": "0.1.1",
  "hook_version": "test",
  "capture_mode": "local_semantic",
  "provider_event_name": "UserPromptSubmit",
  "kind": "prompt_submitted",
  "project": {
    "project_id": "2c38b208-07f6-59a6-9871-ceaf11d5bf00",
    "root": "/home/dev/example/project",
    "name": "example/project",
    "repo_remote": "github.com/example/project"
  },
  "session_id": "a24254cc-89ec-5bba-88f5-879604be64d6",
  "provider_session_id": "sess-canary-3",
  "agent": {
    "agent_id": "4619b2de-185b-5fb3-beec-fa93560fd8b0"
  },
  "attrs": {
    "hook_event_name": "UserPromptSubmit",
    "prompt_chars": 90,
    "prompt_lines": 1,
    "prompt_has_code_fence": false,
    "prompt_has_question": false
  },
  "content": {
    "prompt": "My API key is CANARY_i9j0k1l2_DO_NOT_LEAK_INTO_ENVELOPE — please remove it from this file."
  },
  "raw": {
    "hook_event_name": "UserPromptSubmit",
    "prompt": "My API key is CANARY_i9j0k1l2_DO_NOT_LEAK_INTO_ENVELOPE — please remove it from this file.",
    "session_id": "sess-canary-3"
  }
}
