{
  "event_id": "00000000-0000-0000-0000-000000000000",
  "schema_version": 1,
  "device_id": "00000000-0000-0000-0000-000000000000",
  "source_seq": 0,
  "hlc": 0,
  "observed_at": 1787904000000000,
  "captured_at": 0,
  "provider": "codex",
  "adapter_version": "0.1.1",
  "hook_version": "test",
  "capture_mode": "local_semantic",
  "provider_event_name": "SubagentStart",
  "kind": "subagent_started",
  "project": {
    "project_id": "2c38b208-07f6-59a6-9871-ceaf11d5bf00",
    "root": "/home/dev/example/project",
    "name": "example/project",
    "repo_remote": "github.com/example/project"
  },
  "session_id": "0c0bbd55-b1fa-57da-85a0-bde72922fb6c",
  "provider_session_id": "sess-codex-2",
  "provider_turn_id": "turn-2",
  "agent": {
    "agent_id": "14d5e514-9ce2-58d9-b5ff-5bc751bfa7bd",
    "provider_agent_id": "agent-codex-1",
    "agent_type": "explorer",
    "parent_agent_id": "4de3708d-1304-5589-894e-7cd449c41ff7"
  },
  "attrs": {
    "hook_event_name": "SubagentStart",
    "cwd": "~/example/project",
    "is_subagent": true,
    "agent_type": "explorer"
  },
  "raw": {
    "hook_event_name": "SubagentStart",
    "session_id": "sess-codex-2",
    "turn_id": "turn-2",
    "cwd": "/home/dev/example/project",
    "agent_id": "agent-codex-1",
    "agent_type": "explorer"
  }
}
