{
  "event_id": "00000000-0000-0000-0000-000000000000",
  "schema_version": 1,
  "device_id": "00000000-0000-0000-0000-000000000000",
  "source_seq": 0,
  "hlc": 0,
  "observed_at": 1787904000000000,
  "captured_at": 0,
  "provider": "codex",
  "adapter_version": "0.1.1",
  "hook_version": "test",
  "capture_mode": "local_semantic",
  "provider_event_name": "UserPromptSubmit",
  "kind": "prompt_submitted",
  "project": {
    "project_id": "2c38b208-07f6-59a6-9871-ceaf11d5bf00",
    "root": "/home/dev/example/project",
    "name": "example/project",
    "repo_remote": "github.com/example/project"
  },
  "session_id": "0c0bbd55-b1fa-57da-85a0-bde72922fb6c",
  "provider_session_id": "sess-codex-2",
  "provider_turn_id": "turn-1",
  "agent": {
    "agent_id": "4de3708d-1304-5589-894e-7cd449c41ff7"
  },
  "attrs": {
    "hook_event_name": "UserPromptSubmit",
    "cwd": "~/example/project",
    "prompt_chars": 124,
    "prompt_lines": 1,
    "prompt_has_code_fence": false,
    "prompt_has_question": true
  },
  "content": {
    "prompt": "Add a retry to the sync client. Read SECRET_TOKEN from the environment, never hardcode it. Why does the current client hang?"
  },
  "raw": {
    "hook_event_name": "UserPromptSubmit",
    "session_id": "sess-codex-2",
    "turn_id": "turn-1",
    "cwd": "/home/dev/example/project",
    "prompt": "Add a retry to the sync client. Read SECRET_TOKEN from the environment, never hardcode it. Why does the current client hang?"
  }
}
