{
  "event_id": "00000000-0000-0000-0000-000000000000",
  "schema_version": 1,
  "device_id": "00000000-0000-0000-0000-000000000000",
  "source_seq": 0,
  "hlc": 0,
  "observed_at": 1787904000000000,
  "captured_at": 0,
  "provider": "claude_code",
  "adapter_version": "0.1.1",
  "hook_version": "test",
  "capture_mode": "local_semantic",
  "provider_event_name": "PostToolUse",
  "kind": "tool_call_finished",
  "project": {
    "project_id": "2c38b208-07f6-59a6-9871-ceaf11d5bf00",
    "root": "/home/dev/example/project",
    "name": "example/project",
    "repo_remote": "github.com/example/project"
  },
  "session_id": "3521dae7-d507-52ea-b7e7-8a5f994c9783",
  "provider_session_id": "sess-canary-1",
  "agent": {
    "agent_id": "a9203b7c-5bf8-5998-9ef7-d2a3e512c293"
  },
  "tool": {
    "name": "Write",
    "category": "file_write"
  },
  "paths": [
    {
      "original": "~/example/project/secret.ts",
      "logical": "~/example/project/secret.ts",
      "repo_relative": "secret.ts"
    }
  ],
  "outcome": {
    "status": "success"
  },
  "attrs": {
    "hook_event_name": "PostToolUse",
    "file_ext": "ts",
    "file_is_test": false,
    "file_is_config": false,
    "file_is_doc": false,
    "lines_added": 2,
    "lines_removed": 0
  },
  "content": {
    "tool_input": {
      "file_path": "/home/dev/example/project/secret.ts",
      "content": "const apiKey = 'CANARY_a1b2c3d4_DO_NOT_LEAK_INTO_ENVELOPE'\nconsole.log(apiKey)"
    }
  },
  "raw": {
    "hook_event_name": "PostToolUse",
    "tool_name": "Write",
    "tool_input": {
      "file_path": "/home/dev/example/project/secret.ts",
      "content": "const apiKey = 'CANARY_a1b2c3d4_DO_NOT_LEAK_INTO_ENVELOPE'\nconsole.log(apiKey)"
    },
    "session_id": "sess-canary-1"
  }
}
